<?xml version="1.0" encoding="UTF-8"?>
<dataroot xmlns:od="urn:schemas-microsoft-com:officedata" xmlns:xsi="http://www.w3.org/2001/XMLSchema-instance"  xsi:noNamespaceSchemaLocation="cliente.xsd" generated="2025-09-06T08:03:41">
<cliente>
<idcliente>29</idcliente>
<nombre>LISBETH (ENTRE RIOS) </nombre>
<descripcion></descripcion>
<telefono></telefono>
</cliente>
<cliente>
<idcliente>30</idcliente>
<nombre>BLANCA (IVIRGARZAMA) </nombre>
<descripcion></descripcion>
<telefono></telefono>
</cliente>
<cliente>
<idcliente>31</idcliente>
<nombre>HILDA (SHINAOTA) </nombre>
<descripcion></descripcion>
<telefono></telefono>
</cliente>
<cliente>
<idcliente>32</idcliente>
<nombre>REYNALDO (VENTAS)</nombre>
<descripcion></descripcion>
<telefono></telefono>
</cliente>
<cliente>
<idcliente>33</idcliente>
<nombre>COMERCIAL BEIJING</nombre>
<descripcion></descripcion>
<telefono></telefono>
</cliente>
<cliente>
<idcliente>34</idcliente>
<nombre>ROLANDO QUISPE (EL ALTO)</nombre>
<descripcion></descripcion>
<telefono></telefono>
</cliente>
<cliente>
<idcliente>35</idcliente>
<nombre>JULIO ROQUE (YACUIBA)</nombre>
<descripcion></descripcion>
<telefono></telefono>
</cliente>
<cliente>
<idcliente>36</idcliente>
<nombre>JUAN JOSE MAMANI (EL ALTO)</nombre>
<descripcion></descripcion>
<telefono></telefono>
</cliente>
<cliente>
<idcliente>37</idcliente>
<nombre>GABINO JUSTO (EL ALTO)</nombre>
<descripcion></descripcion>
<telefono></telefono>
</cliente>
<cliente>
<idcliente>38</idcliente>
<nombre>GONZALO LOPEZ (ELECTRODO)</nombre>
<descripcion></descripcion>
<telefono></telefono>
</cliente>
<cliente>
<idcliente>39</idcliente>
<nombre>BERTO JIMENEZ (VALLE GRANDE)</nombre>
<descripcion></descripcion>
<telefono></telefono>
</cliente>
<cliente>
<idcliente>40</idcliente>
<nombre>AMADEO CUENCA FLORES (ELECTRODO)</nombre>
<descripcion></descripcion>
<telefono></telefono>
</cliente>
<cliente>
<idcliente>41</idcliente>
<nombre>FERNANDO BARRERA (INOX)</nombre>
<descripcion></descripcion>
<telefono></telefono>
</cliente>
<cliente>
<idcliente>42</idcliente>
<nombre>ORLANDO MAMANI (VILLAZON)</nombre>
<descripcion></descripcion>
<telefono></telefono>
</cliente>
<cliente>
<idcliente>43</idcliente>
<nombre>ALEX SIGUARIO (TARIJA)</nombre>
<descripcion></descripcion>
<telefono></telefono>
</cliente>
<cliente>
<idcliente>44</idcliente>
<nombre>AMERICO PEREZ (INOX)</nombre>
<descripcion></descripcion>
<telefono></telefono>
</cliente>
<cliente>
<idcliente>45</idcliente>
<nombre>JUAN CONTRERAS (LA PAZ)</nombre>
<descripcion></descripcion>
<telefono></telefono>
</cliente>
<cliente>
<idcliente>46</idcliente>
<nombre>JOSE MAMANI (LLALLAGUA)</nombre>
<descripcion></descripcion>
<telefono></telefono>
</cliente>
<cliente>
<idcliente>47</idcliente>
<nombre>MICHAEL VILLALOBOS (EL ALTO)</nombre>
<descripcion></descripcion>
<telefono></telefono>
</cliente>
<cliente>
<idcliente>48</idcliente>
<nombre>FELICIANO AGUILAR (ALAMBRE MIG)</nombre>
<descripcion></descripcion>
<telefono></telefono>
</cliente>
<cliente>
<idcliente>49</idcliente>
<nombre>GARY VALERO (PINTURA)</nombre>
<descripcion></descripcion>
<telefono></telefono>
</cliente>
<cliente>
<idcliente>50</idcliente>
<nombre>ALEXANDRE LOPEZ (INOX)</nombre>
<descripcion></descripcion>
<telefono></telefono>
</cliente>
<cliente>
<idcliente>51</idcliente>
<nombre>VALERIO JARJURI</nombre>
<descripcion></descripcion>
<telefono></telefono>
</cliente>
<cliente>
<idcliente>52</idcliente>
<nombre>NOEMI MONTAÑO</nombre>
<descripcion></descripcion>
<telefono></telefono>
</cliente>
<cliente>
<idcliente>53</idcliente>
<nombre>JULIO ROQUE (YACUIBA)</nombre>
<descripcion></descripcion>
<telefono></telefono>
</cliente>
<cliente>
<idcliente>54</idcliente>
<nombre>EDSON METALINOX </nombre>
<descripcion></descripcion>
<telefono></telefono>
</cliente>
<cliente>
<idcliente>55</idcliente>
<nombre>ERNESTO GARCIA (AYACUCHO)</nombre>
<descripcion></descripcion>
<telefono></telefono>
</cliente>
<cliente>
<idcliente>56</idcliente>
<nombre>ERNESTO (SHINAOTA) </nombre>
<descripcion></descripcion>
<telefono></telefono>
</cliente>
<cliente>
<idcliente>57</idcliente>
<nombre>HILARIA CRUZ (MIZQUE)</nombre>
<descripcion></descripcion>
<telefono></telefono>
</cliente>
<cliente>
<idcliente>58</idcliente>
<nombre>GENOVEVA MACHADO (ENTRE RIOS)</nombre>
<descripcion></descripcion>
<telefono></telefono>
</cliente>
<cliente>
<idcliente>59</idcliente>
<nombre>COMERCIAL FLORES</nombre>
<descripcion></descripcion>
<telefono></telefono>
</cliente>
<cliente>
<idcliente>60</idcliente>
<nombre>OMAR (YAPACANI)</nombre>
<descripcion></descripcion>
<telefono></telefono>
</cliente>
<cliente>
<idcliente>61</idcliente>
<nombre>HUGO QUISPE CABRERA</nombre>
<descripcion></descripcion>
<telefono></telefono>
</cliente>
<cliente>
<idcliente>62</idcliente>
<nombre>ALEXANDRE LOPEZ (INOX)</nombre>
<descripcion></descripcion>
<telefono></telefono>
</cliente>
<cliente>
<idcliente>63</idcliente>
<nombre>ALEXANDRA RODRIGUEZ (TARIJA)</nombre>
<descripcion></descripcion>
<telefono></telefono>
</cliente>
<cliente>
<idcliente>64</idcliente>
<nombre>ALEXANDER CASTILLO</nombre>
<descripcion></descripcion>
<telefono></telefono>
</cliente>
<cliente>
<idcliente>65</idcliente>
<nombre>HUGO PORCO ESTRADA (TARIJA) </nombre>
<descripcion></descripcion>
<telefono></telefono>
</cliente>
<cliente>
<idcliente>66</idcliente>
<nombre>HUGO MONTAÑO </nombre>
<descripcion></descripcion>
<telefono></telefono>
</cliente>
<cliente>
<idcliente>67</idcliente>
<nombre>CLIENTE-VARIOS</nombre>
<descripcion></descripcion>
<telefono></telefono>
</cliente>
</dataroot>
